{
  "source_id": "SRC-ICHING-QIMENG-TONGSHI-001",
  "title": "易學啟蒙通釋（四庫全書本）",
  "creators": [
    {
      "name": "胡方平",
      "role": "author"
    },
    {
      "name": "Wikisource contributors",
      "role": "editor"
    }
  ],
  "source_type": "book",
  "language": "zh-Hant",
  "edition_or_version": "Wikisource transcription of the Siku Quanshu edition",
  "locators": [
    {
      "kind": "url",
      "value": "https://zh.wikisource.org/wiki/%E6%98%93%E5%AD%B8%E5%95%9F%E8%92%99%E9%80%9A%E9%87%8B_%28%E5%9B%9B%E5%BA%AB%E5%85%A8%E6%9B%B8%E6%9C%AC%29/%E5%85%A8%E8%A6%BD",
      "stable": true
    }
  ],
  "retrieved_at": "2026-07-23",
  "local_snapshot": {
    "retained": true,
    "path": "references/library/SRC-ICHING-QIMENG-TONGSHI-001.md",
    "sha256": "0b94ff28f84f2986525da1423abd53796abfb7c2d048617a4b5b85add352b7d5"
  },
  "license": {
    "identifier": "Public-Domain-original/CC-BY-SA-4.0-transcription",
    "url": "https://creativecommons.org/licenses/by-sa/4.0/",
    "text_available": true,
    "additional_terms": false
  },
  "rights": {
    "commercial_use": "allowed",
    "derivative_use": "allowed",
    "translation": "allowed",
    "images": "not_applicable",
    "dataset": "allowed",
    "notes": "The historical work is public domain; the Wikisource transcription is attributed under CC BY-SA 4.0."
  },
  "rights_review": {
    "status": "accepted",
    "reviewer": "source-audit-2026-07-23",
    "reviewed_at": "2026-07-23",
    "evidence": "The Wikisource page identifies the historical edition and supplies the complete changing-line-count routing passages with the site license."
  },
  "usage_status": "production",
  "systems": [
    "iching"
  ],
  "lineages": [
    "zhu-xi-count-routing-v0.3"
  ],
  "quality": {
    "authority": "primary",
    "independence": "independent",
    "reliability": "high",
    "notes": "Direct historical commentary preserving the zero-through-six changing-line routing attributed to Zhu Xi; used for routing only, not predictive validity."
  }
}
