{
  "source_id": "SRC-NUMEROLOGY-CHEIRO-001",
  "title": "Cheiro's Book of Numbers, Volumes 1–2",
  "creators": [{ "name": "Cheiro", "role": "author" }],
  "source_type": "book",
  "language": "en",
  "publication_date": "1927",
  "edition_or_version": "Garden City Publishing Company edition, digitized by Google Books",
  "locators": [
    {
      "kind": "url",
      "value": "https://books.google.com/books?id=-qMgZzxmN1oC",
      "stable": true
    }
  ],
  "retrieved_at": "2026-07-23",
  "local_snapshot": { "retained": false },
  "license": {
    "identifier": "Public-Domain-original/metadata-and-table-facts-only",
    "text_available": true,
    "additional_terms": false,
    "notes": "Only historical letter-value and reduction facts are encoded. No scan, prose, or modern reprint content is redistributed."
  },
  "rights": {
    "commercial_use": "allowed",
    "derivative_use": "allowed",
    "translation": "allowed",
    "images": "not_applicable",
    "dataset": "allowed"
  },
  "rights_review": {
    "status": "accepted",
    "reviewer": "initial-engineering-review",
    "reviewed_at": "2026-07-23",
    "evidence": "The 1927 underlying work is public domain in the United States; production uses uncopyrightable mapping facts and project-authored explanations only."
  },
  "usage_status": "production",
  "systems": ["numerology"],
  "lineages": ["chaldean-name-cheiro-v0.3"],
  "quality": {
    "authority": "practitioner",
    "independence": "independent",
    "reliability": "medium",
    "notes": "Primary historical practitioner source for the selected Chaldean-style mapping, not scientific evidence and not authority for the separate modern Pythagorean label."
  }
}
