{
  "source_id": "SRC-WESTERN-PROJECT-SPEC-001",
  "title": "Project tropical Western astrology contracts v0.3",
  "creators": [{ "name": "divination-skills project", "role": "author" }],
  "source_type": "standard",
  "language": "en",
  "publication_date": "2026-07-23",
  "edition_or_version": "0.3.0",
  "locators": [{ "kind": "local", "value": "systems/western_astrology/LINEAGE.md", "stable": true }],
  "retrieved_at": "2026-07-23",
  "local_snapshot": { "retained": true, "path": "systems/western_astrology/LINEAGE.md" },
  "license": { "identifier": "Apache-2.0", "text_available": true, "additional_terms": false },
  "rights": {
    "commercial_use": "allowed",
    "derivative_use": "allowed",
    "translation": "allowed",
    "images": "not_applicable",
    "dataset": "allowed"
  },
  "rights_review": {
    "status": "accepted",
    "reviewer": "project-owner-license-decision",
    "reviewed_at": "2026-07-23",
    "evidence": "The project owner selected Apache-2.0 for project-authored repository material."
  },
  "usage_status": "production",
  "systems": ["western-astrology"],
  "lineages": ["tropical-geocentric-v0.1", "tropical-geocentric-major-aspects-v0.2", "tropical-traditional-condition-v0.3", "western-event-retained-rectification-v0.2"],
  "quality": {
    "authority": "unknown",
    "independence": "derived",
    "reliability": "medium",
    "notes": "Transparent product policy pending practitioner production review."
  }
}
